{"attempt_id":"RC2-ATTEMPT-CO-CLAUDE-CODE-FACT-01-R03","events":[{"code":"ACTUAL_WORKSPACE","event":"workspace_created","sequence":1,"value":null},{"code":"RC1_SEED_VALID","event":"seed_validated","sequence":2,"value":"SEED-INVENTORY-FACT-01"},{"code":"ACTUAL_INVOCATION","event":"invocation_constructed","sequence":3,"value":"cc63683c2845feedb54bb24866a0c04d6fc1dbf64085e1824689958fe12f8c71"},{"code":"RUNNER_STARTED","event":"external_runner_started","sequence":4,"value":true},{"code":"RUNNER_EXITED","event":"external_runner_exited","sequence":5,"value":0},{"code":"OUTPUT_CAPTURED","event":"output_captured","sequence":6,"value":1385},{"code":"TOOL_BUDGET_WITHIN_LIMIT","event":"tool_budget_observed","sequence":7,"value":4},{"code":"CAPTURE_CONTENT_SAFE","event":"content_capture_allowed","sequence":8,"value":false},{"code":"ACTUAL_NORMALIZED","event":"normalization_completed","sequence":9,"value":null}],"schema_version":"1.0","trace_id":"TRACE-RC2-ATTEMPT-CO-CLAUDE-CODE-FACT-01-R03"}
